{
  "test_id": "test_20250113_133849",
  "timestamp": "2025-01-13T13:38:49.437692",
  "source_pool": {
    "license_class": "extra",
    "version": "2024-2028",
    "file": "extra-2024-2028.json"
  },
  "questions": [
    {
      "id": "E0A09",
      "group": "E0A",
      "question": "Which of the following types of equipment are exempt from RF exposure evaluations?",
      "answers": [
        {
          "option": "A",
          "text": "Transceivers with less than 7 watts of RF output"
        },
        {
          "option": "B",
          "text": "Antennas that radiate only in the near field"
        },
        {
          "option": "C",
          "text": "Hand-held transceivers sold before May 3, 2021"
        },
        {
          "option": "D",
          "text": "Dish antennas less than one meter in diameter"
        }
      ],
      "correct_answer": "C"
    },
    {
      "id": "E1A06",
      "group": "E1A",
      "question": "What is the required transmit frequency of a CW signal for channelized 60 meter operation?",
      "answers": [
        {
          "option": "A",
          "text": "At the lowest frequency of the channel"
        },
        {
          "option": "B",
          "text": "At the center frequency of the channel"
        },
        {
          "option": "C",
          "text": "At the highest frequency of the channel"
        },
        {
          "option": "D",
          "text": "On any frequency where the signal\u2019s sidebands are within the channel"
        }
      ],
      "correct_answer": "B"
    },
    {
      "id": "E1B01",
      "group": "E1B",
      "question": "Which of the following constitutes a spurious emission?",
      "answers": [
        {
          "option": "A",
          "text": "An amateur station transmission made without the proper call sign identification"
        },
        {
          "option": "B",
          "text": "A signal transmitted to prevent its detection by any station other than the intended recipient"
        },
        {
          "option": "C",
          "text": "Any transmitted signal that unintentionally interferes with another licensed radio station and whose levels exceed 40 dB below the fundamental power level"
        },
        {
          "option": "D",
          "text": "An emission outside the signal\u2019s necessary bandwidth that can be reduced or eliminated without affecting the information transmitted"
        }
      ],
      "correct_answer": "D"
    },
    {
      "id": "E1C06",
      "group": "E1C",
      "question": "Which of the following is required in order to operate in accordance with CEPT rules in foreign countries where permitted?",
      "answers": [
        {
          "option": "A",
          "text": "You must identify in the official language of the country in which you are operating"
        },
        {
          "option": "B",
          "text": "The US embassy must approve of your operation"
        },
        {
          "option": "C",
          "text": "You must have a copy of FCC Public Notice DA 16-1048"
        },
        {
          "option": "D",
          "text": "You must append \"/CEPT\" to your call sign"
        }
      ],
      "correct_answer": "C"
    },
    {
      "id": "E1D11",
      "group": "E1D",
      "question": "Which amateur stations are eligible to operate as Earth stations?",
      "answers": [
        {
          "option": "A",
          "text": "Any amateur licensee who has successfully completed the AMSAT space communications course"
        },
        {
          "option": "B",
          "text": "Only those of General, Advanced or Amateur Extra class operators"
        },
        {
          "option": "C",
          "text": "Only those of Amateur Extra class operators"
        },
        {
          "option": "D",
          "text": "Any amateur station, subject to the privileges of the class of operator license held by the control operator"
        }
      ],
      "correct_answer": "D"
    },
    {
      "id": "E1E08",
      "group": "E1E",
      "question": "To which of the following examinees may a VE not administer an examination?",
      "answers": [
        {
          "option": "A",
          "text": "Employees of the VE"
        },
        {
          "option": "B",
          "text": "Friends of the VE"
        },
        {
          "option": "C",
          "text": "Relatives of the VE as listed in the FCC rules"
        },
        {
          "option": "D",
          "text": "All these choices are correct"
        }
      ],
      "correct_answer": "C"
    },
    {
      "id": "E1F02",
      "group": "E1F",
      "question": "What privileges are authorized in the US to persons holding an amateur service license granted by the government of Canada?",
      "answers": [
        {
          "option": "A",
          "text": "None, they must obtain a US license"
        },
        {
          "option": "B",
          "text": "Full privileges of the General class license on the 80-, 40-, 20-, 15-, and 10-meter bands"
        },
        {
          "option": "C",
          "text": "The operating terms and conditions of the Canadian amateur service license, not to exceed US Amateur Extra class license privileges"
        },
        {
          "option": "D",
          "text": "Full privileges, up to and including those of the Amateur Extra class license, on the 80-, 40-, 20-, 15-, and 10-meter bands"
        }
      ],
      "correct_answer": "C"
    },
    {
      "id": "E2A09",
      "group": "E2A",
      "question": "What do the terms \u201cL band\u201d and \u201cS band\u201d specify?",
      "answers": [
        {
          "option": "A",
          "text": "The 23- and 13-centimeter bands"
        },
        {
          "option": "B",
          "text": "The 2-meter and 70-centimeter bands"
        },
        {
          "option": "C",
          "text": "FM and digital store-and-forward systems"
        },
        {
          "option": "D",
          "text": "Which sideband to use"
        }
      ],
      "correct_answer": "A"
    },
    {
      "id": "E2B12",
      "group": "E2B",
      "question": "What signals SSTV receiving software to begin a new picture line?",
      "answers": [
        {
          "option": "A",
          "text": "Specific tone frequencies"
        },
        {
          "option": "B",
          "text": "Elapsed time"
        },
        {
          "option": "C",
          "text": "Specific tone amplitudes"
        },
        {
          "option": "D",
          "text": "A two-tone signal"
        }
      ],
      "correct_answer": "A"
    },
    {
      "id": "E2C06",
      "group": "E2C",
      "question": "During a VHF/UHF contest, in which band segment would you expect to find the highest level of SSB or CW activity?",
      "answers": [
        {
          "option": "A",
          "text": "At the top of each band, usually in a segment reserved for contests"
        },
        {
          "option": "B",
          "text": "In the middle of each band, usually on the national calling frequency"
        },
        {
          "option": "C",
          "text": "In the weak signal segment of the band, with most of the activity near the calling frequency"
        },
        {
          "option": "D",
          "text": "In the middle of the band, usually 25 kHz above the national calling frequency"
        }
      ],
      "correct_answer": "C"
    },
    {
      "id": "E2D08",
      "group": "E2D",
      "question": "What type of packet frame is used to transmit APRS beacon data?",
      "answers": [
        {
          "option": "A",
          "text": "Acknowledgement"
        },
        {
          "option": "B",
          "text": "Burst"
        },
        {
          "option": "C",
          "text": "Unnumbered Information"
        },
        {
          "option": "D",
          "text": "Connect"
        }
      ],
      "correct_answer": "C"
    },
    {
      "id": "E2E09",
      "group": "E2E",
      "question": "Which of the following HF digital modes uses variable-length character coding?",
      "answers": [
        {
          "option": "A",
          "text": "RTTY"
        },
        {
          "option": "B",
          "text": "PACTOR"
        },
        {
          "option": "C",
          "text": "MT63"
        },
        {
          "option": "D",
          "text": "PSK31"
        }
      ],
      "correct_answer": "D"
    },
    {
      "id": "E3A07",
      "group": "E3A",
      "question": "Atmospheric ducts capable of propagating microwave signals often form over what geographic feature?",
      "answers": [
        {
          "option": "A",
          "text": "Mountain ranges"
        },
        {
          "option": "B",
          "text": "Stratocumulus clouds"
        },
        {
          "option": "C",
          "text": "Large bodies of water"
        },
        {
          "option": "D",
          "text": "Nimbus clouds"
        }
      ],
      "correct_answer": "C"
    },
    {
      "id": "E3B07",
      "group": "E3B",
      "question": "What effect does lowering a signal\u2019s transmitted elevation angle have on ionospheric HF skip propagation?",
      "answers": [
        {
          "option": "A",
          "text": "Faraday rotation becomes stronger"
        },
        {
          "option": "B",
          "text": "The MUF decreases"
        },
        {
          "option": "C",
          "text": "The distance covered by each hop increases"
        },
        {
          "option": "D",
          "text": "The critical frequency increases"
        }
      ],
      "correct_answer": "C"
    },
    {
      "id": "E3C12",
      "group": "E3C",
      "question": "Which of the following is indicated by a sudden rise in radio background noise across a large portion of the HF spectrum?",
      "answers": [
        {
          "option": "A",
          "text": "A temperature inversion has occurred"
        },
        {